{
  "schema_version": "schema-phase-2",
  "document_set_hash": "aaaaaaaaaaaaaaaaaaaaaaaaaaaaaaaaaaaaaaaaaaaaaaaaaaaaaaaaaaaaaaaa",
  "validated_at": "2026-06-26T00:00:00Z",
  "status": "pass",
  "results": [
    {
      "rule_id": "SCHEMA-001",
      "suite": "schema",
      "status": "pass",
      "severity": "info",
      "message": "Document set satisfies the structural schema contract."
    }
  ],
  "verdict": {
    "rating": "Benchmark Quality Confirmed"
  }
}
